{
  "schema": "specgen/authoring-event/v1alpha1",
  "id": "EVT-002",
  "spec_id": "critical-valid",
  "sequence": 2,
  "recorded_at": "2026-08-27T00:01:00Z",
  "kind": "decision",
  "actor": "user",
  "affected_refs": [
    "REQ-002"
  ],
  "payload": {
    "decision": "Authoring history is append-only."
  }
}
